{
  "schema_version": 1,
  "module": "port-check",
  "results": [],
  "unreachable": [],
  "unique_ips_checked": 0,
  "duplicates_skipped": 0,
  "skipped_no_ip": [
    "acc-app.fixture-target.test",
    "acc.app.fixture-target.test",
    "acc.fixture-target.test",
    "access-app.fixture-target.test",
    "access.app.fixture-target.test",
    "access.fixture-target.test",
    "acs.example.com",
    "ad.example.com",
    "admin-app.fixture-target.test",
    "admin.app.fixture-target.test",
    "admin.example.com",
    "admin.fixture-target.test",
    "administrator-app.fixture-target.test",
    "administrator.app.fixture-target.test",
    "administrator.fixture-target.test",
    "ads-app.fixture-target.test",
    "ads.app.fixture-target.test",
    "ads.fixture-target.test",
    "ai.example.com",
    "alumni.example.com",
    "api-app.fixture-target.test",
    "api.app.fixture-target.test",
    "api.example.com",
    "api.fixture-target.test",
    "app-acc.fixture-target.test",
    "app-access.fixture-target.test",
    "app-admin.fixture-target.test",
    "app-administrator.fixture-target.test",
    "app-ads.fixture-target.test",
    "app-api.fixture-target.test",
    "app-asset.fixture-target.test",
    "app-assets.fixture-target.test",
    "app-atlas.fixture-target.test",
    "app-backend.fixture-target.test",
    "app-backup.fixture-target.test",
    "app-beta.fixture-target.test",
    "app-blog.fixture-target.test",
    "app-blogs.fixture-target.test",
    "app-build.fixture-target.test",
    "app-builds.fixture-target.test",
    "app-careers.fixture-target.test",
    "app-cdn.fixture-target.test",
    "app-client.fixture-target.test",
    "app-cloud.fixture-target.test",
    "app-cms.fixture-target.test",
    "app-cms1.fixture-target.test",
    "app-code.fixture-target.test",
    "app-compute.fixture-target.test",
    "app-conf.fixture-target.test",
    "app-content.fixture-target.test",
    "app-core.fixture-target.test",
    "app-corp.fixture-target.test",
    "app-dashboard.fixture-target.test",
    "app-data.fixture-target.test",
    "app-db.fixture-target.test",
    "app-dev.fixture-target.test",
    "app-developer.fixture-target.test",
    "app-developers.fixture-target.test",
    "app-dmz.fixture-target.test",
    "app-docs.fixture-target.test",
    "app-drupal.fixture-target.test",
    "app-eng.fixture-target.test",
    "app-engineering.fixture-target.test",
    "app-faq.fixture-target.test",
    "app-final.fixture-target.test",
    "app-forum.fixture-target.test",
    "app-grafana.fixture-target.test",
    "app-image.fixture-target.test",
    "app-info.fixture-target.test",
    "app-internal.fixture-target.test",
    "app-ir.fixture-target.test",
    "app-k8s.fixture-target.test",
    "app-lab.fixture-target.test",
    "app-ldap.fixture-target.test",
    "app-legacy.fixture-target.test",
    "app-live.fixture-target.test",
    "app-local.fixture-target.test",
    "app-log.fixture-target.test",
    "app-login.fixture-target.test",
    "app-logs.fixture-target.test",
    "app-mail.fixture-target.test",
    "app-manager.fixture-target.test",
    "app-market.fixture-target.test",
    "app-media.fixture-target.test",
    "app-mobile.fixture-target.test",
    "app-monitor.fixture-target.test",
    "app-mssql.fixture-target.test",
    "app-mta-sts.fixture-target.test",
    "app-my.fixture-target.test",
    "app-mysql.fixture-target.test",
    "app-netlify.fixture-target.test",
    "app-o1.fixture-target.test",
    "app-oauth.fixture-target.test",
    "app-oauth2.fixture-target.test",
    "app-office.fixture-target.test",
    "app-origin.fixture-target.test",
    "app-partner.fixture-target.test",
    "app-pay.fixture-target.test",
    "app-payment.fixture-target.test",
    "app-plugins.fixture-target.test",
    "app-private.fixture-target.test",
    "app-prod.fixture-target.test",
    "app-prometheus.fixture-target.test",
    "app-promotion.fixture-target.test",
    "app-proxy.fixture-target.test",
    "app-public.fixture-target.test",
    "app-qa.fixture-target.test",
    "app-raw.fixture-target.test",
    "app-review.fixture-target.test",
    "app-role.fixture-target.test",
    "app-s1.fixture-target.test",
    "app-s3.fixture-target.test",
    "app-search.fixture-target.test",
    "app-server.fixture-target.test",
    "app-service.fixture-target.test",
    "app-shop.fixture-target.test",
    "app-shopify.fixture-target.test",
    "app-stage.fixture-target.test",
    "app-staging.fixture-target.test",
    "app-stats.fixture-target.test",
    "app-storage.fixture-target.test",
    "app-stripe.fixture-target.test",
    "app-tech.fixture-target.test",
    "app-temp.fixture-target.test",
    "app-test.fixture-target.test",
    "app-v1.fixture-target.test",
    "app-v2.fixture-target.test",
    "app-vpn.fixture-target.test",
    "app-web.fixture-target.test",
    "app-wordpress.fixture-target.test",
    "app-wp.fixture-target.test",
    "app-www.fixture-target.test",
    "app-www1.fixture-target.test",
    "app-www2.fixture-target.test",
    "app.acc.fixture-target.test",
    "app.access.fixture-target.test",
    "app.admin.fixture-target.test",
    "app.administrator.fixture-target.test",
    "app.ads.fixture-target.test",
    "app.api.fixture-target.test",
    "app.app.fixture-target.test",
    "app.asset.fixture-target.test",
    "app.assets.fixture-target.test",
    "app.atlas.fixture-target.test",
    "app.backend.fixture-target.test",
    "app.backup.fixture-target.test",
    "app.beta.fixture-target.test",
    "app.blog.fixture-target.test",
    "app.blogs.fixture-target.test",
    "app.build.fixture-target.test",
    "app.builds.fixture-target.test",
    "app.careers.fixture-target.test",
    "app.cdn.fixture-target.test",
    "app.client.fixture-target.test",
    "app.cloud.fixture-target.test",
    "app.cms.fixture-target.test",
    "app.cms1.fixture-target.test",
    "app.code.fixture-target.test",
    "app.compute.fixture-target.test",
    "app.conf.fixture-target.test",
    "app.content.fixture-target.test",
    "app.core.fixture-target.test",
    "app.corp.fixture-target.test",
    "app.dashboard.fixture-target.test",
    "app.data.fixture-target.test",
    "app.db.fixture-target.test",
    "app.dev.fixture-target.test",
    "app.developer.fixture-target.test",
    "app.developers.fixture-target.test",
    "app.dmz.fixture-target.test",
    "app.docs.fixture-target.test",
    "app.drupal.fixture-target.test",
    "app.eng.fixture-target.test",
    "app.engineering.fixture-target.test",
    "app.example.com",
    "app.faq.fixture-target.test",
    "app.final.fixture-target.test",
    "app.fixture-target.test",
    "app.forum.fixture-target.test",
    "app.grafana.fixture-target.test",
    "app.image.fixture-target.test",
    "app.info.fixture-target.test",
    "app.internal.fixture-target.test",
    "app.ir.fixture-target.test",
    "app.k8s.fixture-target.test",
    "app.lab.fixture-target.test",
    "app.ldap.fixture-target.test",
    "app.legacy.fixture-target.test",
    "app.live.fixture-target.test",
    "app.local.fixture-target.test",
    "app.log.fixture-target.test",
    "app.login.fixture-target.test",
    "app.logs.fixture-target.test",
    "app.mail.fixture-target.test",
    "app.manager.fixture-target.test",
    "app.market.fixture-target.test",
    "app.media.fixture-target.test",
    "app.mobile.fixture-target.test",
    "app.monitor.fixture-target.test",
    "app.mssql.fixture-target.test",
    "app.mta-sts.fixture-target.test",
    "app.my.fixture-target.test",
    "app.mysql.fixture-target.test",
    "app.netlify.fixture-target.test",
    "app.o1.fixture-target.test",
    "app.oauth.fixture-target.test",
    "app.oauth2.fixture-target.test",
    "app.office.fixture-target.test",
    "app.origin.fixture-target.test",
    "app.partner.fixture-target.test",
    "app.pay.fixture-target.test",
    "app.payment.fixture-target.test",
    "app.plugins.fixture-target.test",
    "app.private.fixture-target.test",
    "app.prod.fixture-target.test",
    "app.prometheus.fixture-target.test",
    "app.promotion.fixture-target.test",
    "app.proxy.fixture-target.test",
    "app.public.fixture-target.test",
    "app.qa.fixture-target.test",
    "app.raw.fixture-target.test",
    "app.review.fixture-target.test",
    "app.role.fixture-target.test",
    "app.s1.fixture-target.test",
    "app.s3.fixture-target.test",
    "app.search.fixture-target.test",
    "app.server.fixture-target.test",
    "app.service.fixture-target.test",
    "app.shop.fixture-target.test",
    "app.shopify.fixture-target.test",
    "app.stage.fixture-target.test",
    "app.staging.fixture-target.test",
    "app.stats.fixture-target.test",
    "app.storage.fixture-target.test",
    "app.stripe.fixture-target.test",
    "app.tech.fixture-target.test",
    "app.temp.fixture-target.test",
    "app.test.fixture-target.test",
    "app.v1.fixture-target.test",
    "app.v2.fixture-target.test",
    "app.vpn.fixture-target.test",
    "app.web.fixture-target.test",
    "app.wordpress.fixture-target.test",
    "app.wp.fixture-target.test",
    "app.www.fixture-target.test",
    "app.www1.fixture-target.test",
    "app.www2.fixture-target.test",
    "app1.fixture-target.test",
    "app10.fixture-target.test",
    "app18.fixture-target.test",
    "app2.fixture-target.test",
    "app20.fixture-target.test",
    "app2017.fixture-target.test",
    "app2018.fixture-target.test",
    "app2019.fixture-target.test",
    "app2020.fixture-target.test",
    "app2021.fixture-target.test",
    "app2022.fixture-target.test",
    "app2023.fixture-target.test",
    "app2024.fixture-target.test",
    "app21.fixture-target.test",
    "app22.fixture-target.test",
    "app23.fixture-target.test",
    "app24.fixture-target.test",
    "app3.fixture-target.test",
    "app4.fixture-target.test",
    "app5.fixture-target.test",
    "app6.fixture-target.test",
    "app7.fixture-target.test",
    "app8.fixture-target.test",
    "app9.fixture-target.test",